{
  "meta": {
    "slug": "rozmowa-z-nauczycielem",
    "tytul": "Rozmowa z nauczycielem",
    "podtytul": "Jak przygotować się na zebranie",
    "archetyp": "PORADNIK",
    "wersja": "1.0",
    "wiek": "dowolny",
    "kategoria": "rodzic",
    "podkategoria": "rozmowy",
    "strony_deklarowane": 36,
    "min_pt_dziecka": 12
  },
  "wstep": {
    "dla_kogo": "Dla rodzica przed pierwszym zebraniem albo przed trudną rozmową o dziecku.",
    "obietnica": "Wchodzisz na zebranie z listą pytań i wychodzisz z zapisanymi odpowiedziami, a nie z samym wrażeniem.",
    "warunek_wejscia": "Żaden. To materiał dla ciebie.",
    "ile_czasu_dziennie": "Rozdział pierwszy czytasz raz, dzień przed zebraniem. Zajmie ci to kwadrans.",
    "jak_korzystac": [
      "Przeczytaj rozdział pierwszy dzień przed rozmową, nie w jej dniu.",
      "Wybierz trzy pytania, nie dziesięć. Trzy zdążysz zadać.",
      "Wydrukuj arkusz notatek z rozdziału drugiego i weź go ze sobą.",
      "Notuj na miejscu. Po powrocie zostanie ci wrażenie, nie zdania.",
      "Rozdział trzeci przeczytaj tego samego wieczoru, póki pamiętasz.",
      "Rubryki są puste. Wypełniasz je u siebie, ołówkiem."
    ],
    "czego_nie_robi": [
      "Nie mówi, kto ma rację w sporze ze szkołą.",
      "Nie jest pismem procesowym ani wzorem skargi.",
      "Nie zawiera porad prawnych.",
      "Nie ocenia nauczycieli ani szkoły. Porządkuje twoją stronę rozmowy."
    ]
  },
  "rozdzialy": [
    {
      "tytul": "rozdział 1. zanim pójdziesz",
      "strony": [
        {
          "id": "r1-s1",
          "typ": "proza",
          "polecenie": "Zacznij tutaj",
          "dane": {
            "akapity": [
              "Zebranie trwa czterdzieści minut. Twoja część to zwykle pięć. W tych pięciu minutach mieści się wszystko, co chcesz wiedzieć o swoim dziecku w szkole.",
              "Dlatego rozmowa bez przygotowania kończy się tak samo u większości rodziców. Wracasz do domu z jednym zdaniem w głowie i nie wiesz, co z nim zrobić.",
              "Nie chodzi o to, żeby wejść z kartką pełną zarzutów. Chodzi o to, żeby wiedzieć, o co pytasz, i zapisać, co usłyszysz.",
              "Ten rozdział przygotowuje cię w kwadrans. Reszta materiału pomaga w trakcie i po rozmowie."
            ]
          }
        },
        {
          "id": "r1-s2",
          "typ": "proza",
          "polecenie": "Ustal jedną rzecz na wyjście",
          "dane": {
            "akapity": [
              "Zanim ułożysz pytania, dokończ zdanie: wyjdę stąd, wiedząc, że… Jedno zdanie, nie pięć.",
              "Może to być: wiem, jak dziecko radzi sobie z czytaniem. Albo: wiem, z kim siedzi i czy ma z kim wyjść na przerwę.",
              "To zdanie jest twoim kompasem. Kiedy rozmowa zejdzie na boczny tor, wracasz do niego i pytasz jeszcze raz.",
              "Jeśli masz trzy takie zdania, wybierz jedno na tę rozmowę. Pozostałe zapisz na następną. Rozmów będzie więcej."
            ]
          }
        },
        {
          "id": "r1-s3",
          "typ": "proza",
          "polecenie": "Zebranie a rozmowa indywidualna",
          "dane": {
            "akapity": [
              "To są dwie różne sytuacje i nie zadaje się na nich tych samych pytań.",
              "Zebranie ogólne dotyczy klasy. Wycieczki, składki, plan roku, ogólny obraz grupy. Twoje dziecko jest tam jednym z dwudziestu pięciu.",
              "Rozmowa indywidualna dotyczy twojego dziecka. Jest krótsza i dostajesz w niej konkretne przykłady.",
              "Jeśli twoje pytanie zaczyna się od „a moje dziecko…”, to jest pytanie na rozmowę indywidualną. Na zebraniu poproś o termin i zapisz go od razu."
            ]
          }
        },
        {
          "id": "r1-s4",
          "typ": "lista_krokow",
          "polecenie": "Przygotowanie w kwadrans",
          "dla_rodzica": "Zrób to dzień wcześniej, nie w drodze do szkoły.",
          "dane": {
            "kroki": [
              "Dokończ zdanie: wyjdę stąd, wiedząc, że…",
              "Wypisz wszystko, co przychodzi ci do głowy. Nie oceniaj na tym etapie.",
              "Skreśl pytania, na które odpowiedź nic nie zmieni w waszym domu.",
              "Z reszty zostaw trzy. Zapisz je na arkuszu z rozdziału drugiego.",
              "Sprawdź, czy któreś jest o innym dziecku. Takie wykreśl.",
              "Przy każdym pytaniu dopisz, kiedy ostatnio widziałeś to w domu.",
              "Wydrukuj arkusz notatek i włóż do torby razem z długopisem."
            ]
          }
        },
        {
          "id": "r1-s5",
          "typ": "proza",
          "polecenie": "Trzy obszary, z których wybierasz",
          "dane": {
            "akapity": [
              "Pytania rodziców mieszczą się prawie zawsze w trzech obszarach.",
              "Pierwszy to postępy: co dziecko już robi samo, a przy czym potrzebuje pomocy. Drugi to funkcjonowanie w grupie: z kim pracuje, jak wygląda przerwa, jak reaguje na zmianę planu.",
              "Trzeci bywa pomijany, a jest najbardziej praktyczny: czego szkoła oczekuje od domu. Ile minut pracy dziennie, co ćwiczyć, czego lepiej nie robić.",
              "Na kolejnych trzech stronach masz gotowe pytania z każdego obszaru. Wybierz trzy łącznie, nie trzy z każdego."
            ]
          }
        },
        {
          "id": "r1-s6",
          "typ": "tabela",
          "polecenie": "Pytania o postępy",
          "dla_rodzica": "Wybierz najwyżej jedno albo dwa. Zapisz je własnymi słowami.",
          "dane": {
            "naglowki_kolumn": [
              "pytanie",
              "co ci daje"
            ],
            "wiersze": [
              [
                "Co robi teraz samo, a czego jeszcze nie robi bez pomocy?",
                "granicę, od której zaczynasz w domu"
              ],
              [
                "Co zmieniło się od września?",
                "kierunek zamiast jednej fotografii"
              ],
              [
                "Przy którym zadaniu widzi pan lub pani najwięcej wysiłku?",
                "jedno miejsce do popracowania"
              ],
              [
                "Jak wygląda jego praca, gdy zadanie jest dłuższe?",
                "obraz wytrwałości, nie samej wiedzy"
              ],
              [
                "Czy prosi o pomoc, kiedy utknie?",
                "rzecz, którą można ćwiczyć w domu"
              ],
              [
                "Po czym pozna pan lub pani, że poszło do przodu?",
                "wspólną miarę na następną rozmowę"
              ]
            ]
          }
        },
        {
          "id": "r1-s7",
          "typ": "tabela",
          "polecenie": "Pytania o życie w grupie",
          "dla_rodzica": "Pytaj o to, co da się zobaczyć. Nie o to, co dziecko czuje.",
          "dane": {
            "naglowki_kolumn": [
              "pytanie",
              "co ci daje"
            ],
            "wiersze": [
              [
                "Z kim pracuje w parze, gdy może wybrać sam?",
                "realny obraz znajomości w klasie"
              ],
              [
                "Jak wygląda jego przerwa?",
                "część dnia, której nigdy nie widzisz"
              ],
              [
                "Co robi, gdy plan dnia się zmienia?",
                "informację o elastyczności, nie o charakterze"
              ],
              [
                "Odzywa się na forum czy raczej przy stoliku?",
                "sposób, w jaki się pokazuje w grupie"
              ],
              [
                "Były w tym miesiącu sytuacje, o których powinienem wiedzieć?",
                "otwarte drzwi bez oskarżania kogokolwiek"
              ],
              [
                "Jak wygląda jego powrót po dniu wolnym?",
                "wskazówkę, ile trwa wejście w rytm"
              ]
            ]
          }
        },
        {
          "id": "r1-s8",
          "typ": "tabela",
          "polecenie": "Pytania o to, czego szkoła oczekuje",
          "dla_rodzica": "Te pytania kończą rozmowę czymś, co zrobisz w przyszłym tygodniu.",
          "dane": {
            "naglowki_kolumn": [
              "pytanie",
              "co ci daje"
            ],
            "wiersze": [
              [
                "Ile minut pracy w domu ma sens w tym wieku?",
                "liczbę zamiast domysłów"
              ],
              [
                "Co powinniśmy ćwiczyć w domu, a co zostawić szkole?",
                "podział zadań, nie dublowanie"
              ],
              [
                "Czego lepiej w domu nie robić?",
                "rzecz, którą zwykle robisz z dobrych chęci"
              ],
              [
                "Jak mam reagować, gdy dziecko nie chce usiąść do zadania?",
                "jedno zdanie do powiedzenia wieczorem"
              ],
              [
                "Jak najlepiej się kontaktować, gdy będę miał pytanie?",
                "kanał i realny czas odpowiedzi"
              ],
              [
                "Kiedy możemy porozmawiać następnym razem?",
                "termin, a nie dobre chęci"
              ]
            ]
          }
        },
        {
          "id": "r1-s9",
          "typ": "proza",
          "polecenie": "Czego nie pytać przy innych rodzicach",
          "dla_rodzica": "Ta strona dotyczy zebrania ogólnego, gdy sala jest pełna.",
          "dane": {
            "akapity": [
              "Na zebraniu ogólnym siedzi dwadzieścia osób. Wszystko, co powiesz, usłyszą wszyscy.",
              "Nie pytaj o innych uczniów, nawet jeśli twoje pytanie dotyczy twojego dziecka. Pytanie „kto go popycha na przerwie” zostanie w głowach rodziców dłużej niż odpowiedź.",
              "Nie pytaj o ocenę swojego dziecka na tle klasy. Nauczyciel i tak nie odpowie, a ty dostaniesz zdanie ogólne.",
              "Nie opowiadaj na forum o zdrowiu dziecka ani o sytuacji w domu. To należy do rozmowy we dwoje.",